app ranking fraud,"Are these good reviews painted out?	"
app repackaging,"Garbage fucking wants money to activate a waste of Laozi's traffic is still a pirated application treasure, which is too garbage	"
illegal redirection,"Garbage fucking wants money to activate a waste of Laozi's traffic is still a pirated application treasure, which is too garbage	"
bad performance,"Every time I play for the second time, it will crash, causing me to unplug the battery	"
ad disruption,"The ad shows eyeshadow eyebrows eyelashes blush other makeup options,  yet when you hit makeup your only options are how dark or light tones to make your facial makeup.  You can slim your face, smooth your face, and make your eyes bigger. Not a selfie improver app."
excessive network traffic,"I used to like its simplicity. Now I find that it is becoming more and more bloated. A browser occupies so much space. Today, I found that I stole my 100m traffic for no reason. I was angry and gave a bad comment	"
bad performance,A browser occupies so much space.
vulgar content,fun enjoyable and some free sexy girls for the young ones
ad disruption,"Many pop-up ads on Web pages can't be removed, and UC headlines will appear at the bottom of some web pages. It's really a family!	"
illegal redirection,"The swindler paid the money and didn't activate it at all. He thought it was downloaded from Huawei's application and should pass the test, so he said he fully believed that Huawei applied this kind of junk software. How can you let him enter your application market?	"
inconsistency between functionality and description,Worst possible app. It's inconsistent and doesn't allow you to delete your profile.
app ranking fraud,"At first, very simple software didn't work, but later, more people used it. Some people made malicious comments and advertisements tried to brush you high praise. Then you slapped me in the face as soon as you updated it. Remember that a programmer made his own software and maintenance, which made me remember that I'm disappointed now	"
privacy or information leak,"After the upgrade, the product data is completely lost, and the recovery backup directly shows that the startup exception cannot be opened	"
bad performance,"Bad applications need to download other software. It costs too much power and takes up a lot of space. It's just playing tricks	"
fail to install,"Why should I lock my number? After downloading and installing it, I lock it in less than two minutes. What does it mean	"
fail to login or register,"Hehe, what contact customer service can't use a star at all. I don't want to register and I can't register. It's really rubbish	"
excessive network traffic,"Junk software can't search at all. What videos are they? I'll cheat the traffic	"
fail to start,"As of last week, the app no longer works. It cycles through a reset message and then crashes. Please fix it!"
illegal redirection,"This game is really rubbish. All the praise is that the game producer has to activate the pit money after downloading it	"
bad performance,"The machine is jammed and cannot be opened	"
app ranking fraud,"It's really disgusting. Don't do it. You can't open it at all. You cheat the traffic. You don't want to give it a star. Unfortunately, you don't give it and don't comment	"
virus,"The game is too poisonous to stop	"
fail to start,I HATE IT EVEEYTIME I TRY TO ADD A TEXT OR STICKER IT SAYS POCKET VIDEO HAS"Stoped"
vulgar content,It's funny and fun Tennessee there's some sexiest girls on the website you know like Charlie demilio you know I so it's telling me to write a 500 paragraph of you but like I don't want to do it so now I'm just like talking on speaker so I don't have to waste my time so now this is me just also still wasting my time and I'm going to leave this with you and see if you guys see it so yeah but anyways to talk is pretty cool you know everyone has fun you can't get caught by being a 50 year old man
bad performance,"Is Xiaomi's mobile phone his garbage grass? What's broken? The wireless network signal is so poor that it's always cut off automatically	"
payment deception,This app may be free to download but you gotta pay to watch anything on it. Deleted. I¡®ll watch clips on Facebook for free. Blaze can suck it.
praise,"I'm completely addicted, I thought it was stupid and downloaded it as a joke, but seriously, it's one of the best. You don't have to dance or make videos, but scrolling and watching has got lots of my time. ??"
ad disruption,Terrible.... not only does it not work but it also shows you ads... :(
app repackaging,"Or a pirated version of a dragon trainer	"
ad disruption,"This app is awful. For an android user, seeing the commercial on TV"
fail to start,"Can't open the system. What's the matter	"
app ranking fraud,"The comments are all brushed. When you open it, you find that the tool icon in the advertising tedo looks very rough, or is it a picture app	"
vulgar content,"Fun and bloody	"
fail to delete,"A pile of entrusted money can't be paid. The bank card can't be deleted	"
virus,"Avast scan shows Trojan horse	"
app ranking fraud,"Damn it It's all fake. Look at the tone of the comments. I believe you have ghosts and disgusting software. Don't fuck it, or you'll lose money	"
drive-by download,I like this app because I could do like videos on it 15 second video and 60 second videos and I really liked it but I have to download a software what i do not like
ad disruption,Only ads.. do not install
vulgar content,"There's different sides to tiktok and i love it, I'm on mha tiktok currently and i feel safe here for being a weeb and there's multiple other Denki simps for me to vibe with, it's also mostly gen z so it's hilarious how ppl talk about yeeting a foetus at a ceiling to see if it would stick there. I love this app and definitely request it just a top tip: if you see any videos like ""creepy facts"" sCROLL DOWN!!! I've had nightmares thinking about the things I've seen and heard of from those videos."
privacy or information leak,"My hard work data of several years are all missing in the process of synchronization. Return my data, or step on the bad comments every day and kill you!!	"
ad disruption,HATE IT DO NOT DOWNLOAD TO MANY ADS I CANT EDIT ANYTHING UGH..
ad disruption,Awful!  Keeps taking down my ads saying it is  forbidden on Wish. Its states I am a advertising for a business. Which I am not I am trying to sell a camper. So I tried listing a different item and it flagged it as well. Terrible app
ad disruption,"It crashes a lot, messenger does NOT work and there are too many ads. Uninstalling."
fail to exit,"How to log out of the game?	"
illegal redirection,links to another site
illegal redirection,Useless. Demands you download from another site
fail to install,"Xiaomi tablet 2 can install games with QQ download, but it can't install games with its own game center download	"
payment deception,deduct the fee for no reason
app ranking fraud,"Scum stuff, deceptive, praise is brushed out. Always trying to read my information. Do you want to deduct the fee? And it's stuck somewhere.	"
permission abuse,I request to you tiktok please deleted the all video one song name is related to our religion and I see the video i am very shamefull us why we give the permission to all the music why you are not equiry this is cast related song her name is (Jung karne mea aya nhi hu) in shia language her call a noha ...so I requested to you please deleted the all video ..otherwise I will complaint on police and submitted the PIL for your apps...thAnks and give me the answer...
vulgar content,i got this app bc of a dare and i was not to exited for it but i still got it. io never opened the app until a year later. this app is SO fun to play on and you can put yourself on private if you dont want ''creeps'' on your account. this is a fun way to express your self in an awsome way!
vulgar content,this has helped a lot and I'm addicted but it's racist and homophobic
fail to install,"Cannot install (& gt; ©n & lt;)	"
app repackaging,"Slot plagiarism - Temo Tianshen middle school, which is obviously changed from the original primary school pirated by ""corpse party""!! despise	"
payment deception,"I thought the app was listings of rentals that accept a Housing Voucher however after downloading and going through the app is out of date, majority of listing DO NOT accept Housing Vouchers or YOU HAVE TO PAY to get information! If i had money to do that probably would i need rent assistance program."
permission abuse,Why do they need my contacts and media  access.
fail to start,"Garbage liar, please don't be unable to open it	"
vulgar content,Good app for sexual constant
payment deception,You have to pay for it this is stupid and dumb
ad disruption,It give you hardly eny light and to much ads
bad performance,"The game crashed at 1:00, and all kinds of crashes didn't respond for half an hour	"
illegal redirection,"Fortunately, later, I had to invite two friends to download it to reflect that I finally saved ten yuan and couldn't put it forward at once (¡ñ - ¡ñ). In addition, after a long brush day, there will be gold coins again in several hours	"
virus,But on android don't load or work. Has a virus have it fixed
ad disruption,It suckes because of the ads
ad disruption,Too many ads to use casually
payment deception,Dude. Pretty weak that you guys say nothing about it only been a three-day trial. After 3 days you have to pay. But you say nothing of this until you download and install the app. Pretty weak guys
fail to install,"Installation package resolution failed	"
fail to delete,"The old track cannot be deleted! Always prompt that the line is too popular to delete! Why?	"
vulgar content,Pretty nice app it has all the vid selections like creepy or funny or just normal or parkour I could go on and on
app ranking fraud,"This is OK, but the QQ brush likes also need to download other things. I download it mainly for the selection head, so I think this software is OK, but it's not too perfect, so I'm satisfied with the praise	"
payment deception,"It's too bad. I sent a text message to me saying that I had five yuan and didn't receive the phone bill. I opened the website and directly subscribed to the customer service for eight yuan. In the past, no one answered * * * client unsubscribe. I can only throw away eight yuan for nothing next month. When does Unicom handle affairs? It's so disgusting! Are you crazy? This is shit	"
bad performance,"This game development is absolutely brain disabled. You have to update it after you install it. It's funny! And I unloaded it once and pressed it again before, and then sent me more than 40 messages. It's very rogue. Since I played it, the mobile phone battery hasn't survived for more than 2 hours. When I go to standby, I can unload the running power. Just delete it and be clean. This software is very rogue!	"
inconsistency between functionality and description,Does absolutely nothing that it claims to do in the ad
excessive network traffic,"A star doesn't want to give it. In the past, it can grab traffic without limit in a month, and then it can grab traffic ten times a month. Now it can only grab traffic five times a month. The signed in traffic is getting less and less every day	"
ad disruption,"Love it, but way too many ads."
permission abuse,"Very accurate. The content is very rich. At first, the third-party account can't log in and share successfully. You need to open a permission	"
fail to start,"After the update, Android 8.0 doesn't support the bus card. You can't get in or recharge NIMA. It's very good before the update. It's really Cao	"
fail to login or register,"Glory nine can't use the verification code and sent it n times!	"
ad disruption,"Total trash, all advertisement."
praise,"Good, good, very good! Permission to answer questions	"
fail to login or register,Wont let me sign in. Terrible.
payment deception,"Scam, do not pay for the extra perks smh cant cancel through app"
app repackaging,"Easy to use. The stand-alone games inside are cracked versions. Aiwu is supported	"
fail to install,Installation  problem
fail to retrieve content,I agree with everyone else. I just get error 404 and nothing works.
vulgar content,It's realy good but some times it gets creepy
vulgar content,Really good so satisfying to watch I just don't like the creepy facts
vulgar content,This is awesome but theres people putting nudes on and when u report it its still ther tiktok fix it pls
app ranking fraud,"Deceptive, praise is brushed	"
payment deception,"fuck! Zhenkeng father's 30 day membership costs 50 yuan	"
permission abuse,This app sucks. Why do I have to give it permission to access my fotos?
fail to login or register,"Garbage can't register!!!! I also downloaded a series of in the sleeping slot, Keng dad goods, madder	"
app ranking fraud,"The Empress Dowager regretted that mobile phones are popular now. She registered her real name without much thought. Then I said all kinds of harassing calls have no plan. If I continue to call, I should read the comments and then install them. The comments are all brushed. It's estimated that mine will also be flooded	"
app ranking fraud,"The comments are disgusting. I look like I'm going to vomit	"
vulgar content,Awesomes tickers... how about some horny ones???
virus,It gave me a virus but it is a great app so entertaining ?
permission abuse,"OK, the software requires too many permissions	"
bad performance,"Huawei 8813 can't be stuck	"
fail to login or register,The app wont let me log in to my account did you guys shut down the servers for this?
vulgar content,It fun you meat new people and funny content it good but don't let kids under 10 or 9 there is bad language and sex stuff but it up to you
bad performance,It consumes 50% of the power
fail to install,"Unable to install updates for two days	"
bad performance,"It consumes too much power. It consumes 22% of the power and can't afford to hurt as much as the screen	"
bad performance,"You can't charge your mobile phone while playing. What if you lose power	"
vulgar content,"love theapp but i had to delete and reinstall it beacuse it wasnt loading. i love the app but i was dared to search naked anda woman was actually naked on camera i reported nothing happenedbbut anyway, just download it its rrly great"
app repackaging,"Scold this pirate and that pirate. Don't you think that the MC you play now is pirated	"
virus,"Constantly bouncing out, payment information toxic?	"
ad disruption,To many ads use to be really good
drive-by download,Ok so it will let me download some apps i put 5 stars because i have the app on my other device but it wont download on this one! I have a samsung so can you help?
fail to login or register,Amazing but I don't know how to login you can't talk to me like it's way better. LOL
fail to login or register,"I haven't received the bill for nearly half a month. The bill in the email can't be read out. It often shows that I can't log in to the email. It's very useful before	"
ad disruption,Never even figured out how to program it because of all of the pop up ads. Ridiculous.
ad disruption,Because of the continuous ad
vulgar content,"Bloody fruit! A strange knife is almost as good as cutting fruit!	"
fail to login or register,"I'm very dissatisfied that the app last year didn't work for a month. I was shocked when I received a bank card text message today. Then I called the customer service and asked if it was love. I wanted to log off again, but I couldn't log on. I hope you don't fall for the same trick as me	"
ad disruption,No street view. Just alot of ads.
fail to start,Stops running
fail to start,Low Quality app cause whenever i open it and im editing video it keeps saying that "these app stop" Please Fix it
payment deception,"Don't download, you have to charge! Don't be trapped	"
vulgar content,For a app that say no sex talk there is a lot of it every single person i talk to want sex and they send nude pictures of them selfs so DO NOT DOWNLOAD IT and i agree with all the other people
ad disruption,What game? I only saw ads!
app ranking fraud,"Downstairs to praise, are tuo, pig, obscene.	"
app ranking fraud,"If you can play the other two modes, you have to pay or pay attention to him on Facebook, and Android can't climb the wall. The so-called attention is false ~ ~ it's better not to upgrade	"
app ranking fraud,"I am also convinced of these comments!	"
vulgar content,"Entertaining, stress relief, sexy."
inconsistency between functionality and description,NOT free! Deceptive advertising!
payment deception,The user agreement says you will have to pay fees for using the app or earn credits. This is NOT FREE app based on this information.
vulgar content,"Yeah, I love the app, but it's amazing. But they still need to get rid of the bullies & the pedophiles... And they still need to bring the issue. Up of a kid committing suicide on a live on Tik Tok but no Tick Tock doesn't want to do that. Because they will bring them reputation. It's all about money and fame. It's ridiculous."
fail to install,i wish my phone would let me download this bit is the best
bad performance,"Bad reviews often crash, restart the machine for more than 10 minutes, delay time to find customer service, ignore and so on	"
payment deception,"I called in because I suddenly lost access to Pandora and I thought that it had to do with my phone because the outage coincided with my purchase of a new phone. What I found, when I called in, was my 1 year trial had just expired and I was lead to believe that the expiration of my plan was the reason that I lost access to Pandora and once I renewed everything would work fine. Well I did renew for another year only to find that the issue was not with my expired plan but an issue with an app update. I was duped into shelling out $150 for what is now a completely useless app.?I would like my $150 refunded until you get this issue fixed because I do not want to pay for something that does not work. As a matter of fact you should refund all of the users for the time that this app is not working."
virus,"Son of a bitch is a Trojan horse	"
fail to delete,"Why can't you delete it!	"
excessive network traffic,"It's cheap to cheat mobile data	"
inconsistency between functionality and description,"Got this app because of the no limit to swiping, I was fine with getting a decent amount of swipes a day with a 24 hour limit. Now it's an inconsistent time limit and i'd be lucky to get 6-10 swipes at a time??"
virus,"It looks like delicious food. It may be poisonous to eat	"
app repackaging,"There seems to be a cracked version of internal purchase! Research on infinite gold coins	"
permission abuse,"It's good to use. Why do you have to do with so many permissions? Hey! It makes me feel that I am still suspected of rogue software	"
payment deception,"BS to get ya in and then, oh wait, you must pay to use this app.  What a load.  Delete!!!"
illegal redirection,"BS to get ya in and then, oh wait, you must pay to use this app.  What a load.  Delete!!!"
excessive network traffic,"Can't open broken things to cheat mobile data!!	"
fail to install,very happy about this program it is very nice but on my tablet it doesnt install whyy
excessive network traffic,"The amount of garbage fraud data is given. Please refuse to waste traffic in seconds in the first instance	"
privacy or information leak,"The data package is gone after downloading	"
excessive network traffic,"Deceiving people data traffic and saying that what is an offline map is deceiving	"
fail to retrieve content,"There is no online customer service activity page. Click the verification code and there is no response. My financial management Click to open the blank and dare not invest	"
ad disruption,I hate this game it has way too many ads
drive-by download,This app is the best but we can't delete it if u dont have this app u won't download it HIRRY PLEASE DONLOAD ITTT IT DELATE IN SUNDAY OR SATURDAY THIS WEEEEEKKKKKK
bad performance,"Don't go down! Cell phone crash	"
fail to install,"The good thing is that I don't know why the beautified version of QQ can't be installed	"
payment deception,"It's too fake. It's a scam	"
fail to login or register,"Why can't wechat log on	"
virus,"Amoy news virus, do not download carefully, Alipay WeChat money stolen.	"
app repackaging,This game is called cool grapefruit tank in the Saipan era. It's a different name here.
payment deception,"In the past, it was easy to pass all five levels. Now you have to charge after playing the first game. You have to charge for putting a nuclear bomb, nothing. There is no improvement in the game"
app ranking fraud,"The change is to double the money in disguise. The previous praise is all entrusted.	"
bad performance,"What happened to the crash when starting the housekeeper?	"
vulgar content,I would love the creators to see this review.....sooo....i like the app but there is a big...and i mean a RLY big problem with some sexual content..... I uninstalled this app because of this problem.....i feel bad because tiktok was ruined because of this so i would love the creators to try and fix this problem Oh and please...can a real person answer to my review....i rly want to help tiktok team to improve this app
permission abuse,Why do you need to know my location and have access to my files to tell me about the Olympics?  Immediate uninstall
praise,Awesome app I became tik tok obsessed after just one day. The app is completley free i highly recommend downloading this app!.
ad disruption,Wasy too many advertisements. Uninstall.
payment deception,I love the idea. As black people we like to use our skin tones when communicating with people. But we have to pay? Are you kidding me? Your not going to get far with this app at all no matter what features you put in it.
illegal redirection,"Nima is too pit father. You don't have to download a go desktop before you can use it. It's more than ten megabytes. It's really pit!	"
drive-by download,"Nima is too pit father. You don't have to download a go desktop before you can use it. It's more than ten megabytes. It's really pit!	"
illegal redirection,"Do you have to download all kinds of software to use?	"
drive-by download,"Do you have to download all kinds of software to use?	"
fail to login or register,"You can't log in after updating	"
virus,DO NOT GET THIS APP!!! It gave me a virus
excessive network traffic,"Today, the sneak traffic ran for more than 30 yuan and stopped the machine. I found that there was no such problem before. It didn't rise by 2.0. I like it simple	"
fail to login or register,"I can't even get on the garbage	"
fail to install,"**The software cannot be used after installation	"
ad disruption,"Absolutely worst dating app ever. All it is, is a web wrapper for their web site. Full of ads. Do not install!!!"
fail to start,Its not working at all it tells to reset n then still it doesntt work.. plz fix it
fail to install,"The installation package is not interesting	"
privacy or information leak,"Despite it being an abvious data mining, mind numbing, brainwashing, spyware app created to steal personal info, its pretty fun."
privacy or information leak,Nice app but my drafts videos get deleted after I updated it or download again
ad disruption,Garbage. You can do nothing except watch ads & anything else glitches & takes You back to ads again
fail to login or register,How to login previous account
bad performance,"This app is the best! if your looking to:make friends and have a laugh then TikTok is your best bet! BUT theres adds but not while your making your TikTok (no no no) only while your scrolling through the following or for you page Aka recomened.I highly suggest you should get this incredible app THIS ISNTANT its does take up a bit of storage,maybe even your gallery space (but you can delete videos you don't like or want). Thet me just say you'll need your parants permission before downloading?"
vulgar content,Entertaining but you should block automatically porn like videos or hatred or anything about strong subjects. I think tik tok is an app just for fun. ??
app repackaging,"Yes, this is a cracked version. It's very professional. It's just that there are too few downloads. It may be because there are no functions such as beauty filter and image repair	"
app repackaging,DO ME A FAVOR AND STOP COPYING THE REAL MIMECRAFT AND GET A LIFE. OR BUY THE REAL GAME AND GET RID OF THIS ONE.
privacy or information leak,"It is soooooo fun! But children should not be on it. To me Tik Tok is for 13+ because children can make an account and hackers can steal their information. If you are 13+ you know about the safety online. To the parents, if your child is 12- 11 they will be OK. If you're child is 10- they should not be on it. Thank you for reading."
drive-by download,I like Tik Tok but I could not post it wouldn't let me post my friends wanted to see my Tik tok's but I could only draft so that's why I didn't like to talk I wish I could post because I do pretty good Tik tok's and pretty funny ones sometimes and cringy ones so that's why I wanted my friends to see them but they couldn't because I could not post and I deleted it and re-downloaded it and deleted it and re-downloaded it and deleted it and redownload it again but I can't say I liked it was fun too
privacy or information leak,"It's too bad. You can't log out with network synchronization information. After logging in, there's no data	"
app ranking fraud,"Why do you brush so many good and false feelings	"
vulgar content,WTH? There was porn/dating ads on my baby night light????? Hope.I didnt.just install a.virus. Removed that crap ASAP. DO NOT GET
