vulgar content,"I was lying alone, bedridden and catatonic in my house with my family. As I lay, I heard a faint noise coming from afar. It was my brother being a bad boy trying to attract a good girl and my cousin struggled to select the right Overwatch hero. I wasn't sure what was going on but the sound got louder and louder. Then it grew into a song. In an instant I came to, and fixed my eyes on my parents who were sitting beside me, shocked and surprised. But my mind was still focused on the discordant noise/harmonic tune creeping slowly through the door. My brother and cousin were filming themselves lip-syncing to songs. I felt compelled to get up an rise to a 90¡ã angle straight out of bed, within mere seconds I began partaking in their antics. Then they told me what it was. TikTok cured my everlasting unconsciousness and broke my comatose state. I heard the two words ""Nerf Bastion"" and I began breathing and coming to my senses. Thank you TikTok."
fail to install,"Install dongxi'an dog stuff	"
payment deception,Itsaid pay 99 ents I had 14 dolles but I spend it on games and now I have 98 ceants
permission abuse,"Permissions too broad to start. I can understand location required, but why require access to photos? So I Uninstalled it."
ad disruption,There is just a lot of full-screen advertising and an embedded Google Maps
fail to install,When i had it it was the best but i got a new phone and it wont let me download it ?
permission abuse,"Said very reluctantly! How did the agreed no root screenshot become a need for root permission! No love! It's the most unacceptable. It's a combination of Chinese and English! Bully me, don't you know English! I just want an ordinary screenshot. Is it difficult?	"
permission abuse,"Too many permissions are required	"
fail to login or register,"Why can't QQ log on?	"
fail to login or register,"This application is a spam application. Every time, it is a ball like login. It can't log in to the spam application	"
virus,"There is a problem with this. After installing my drop-down menu, there will be no more! Is there a bug or virus? Please answer it!	"
fail to install,"Easy to use is that the new version cannot be installed. What do you say is that there is a lack of shared libraries	"
fail to retrieve content,Waste of time  because  when you go into it just sez error 404
vulgar content,"WISH IT WAS FOR 18+ ONLY. Parents need to be aware of the content on TikTok. And clearly this app doesn't listen to its creators and deletes peoples accounts that speak out against pedophiles and they leave the pedophile account up because the pedo has a larger following. There is so much inappropriate stuff for underage teens/kids on this app. They don't understand that they are underage and think their inappropriate clothing, dancing and facial expressions are harmless."
fail to retrieve content,I hate it keep saying 404 error
fail to exit,"Cannot exit	"
privacy or information leak,"The software is not bad, but I don't know the security. Many people need to enter a password	"
fail to install,"Can't install it. I'm depressed	"
payment deception,u mother u changed it now we have to pay
drive-by download,"The Internet speed of garbage forced download is very poor	"
bad performance,"The game design is very good, but there are bugs. Once you play, there will be two computer crashes!	"
vulgar content,"Great communities... Being on the app for just a little while is enough to change content to something that interests you. Some people think it's creepy but IDK man, I think there's other things to worry about lmao."
bad performance,"An average of 5 operations and one crash	"
payment deception,"Swindler software don't believe in cheating people's money	"
fail to install,"Hello Tiktok Team! I can't install tiktok app since my phone reset due to some issues but now it's stuck on installing after completing 100% and a popup appear that sorry you cannot install this app Tried from many stores like samsung store,playstore Please solve this problem"
fail to install,"The latest version cannot be installed. You can only use version 2.3.2	"
drive-by download,Very good app but my parents don't let me install the app
excessive network traffic,waste my mobile data 
payment deception,YOU HAVE TO PAY 11 DOLLARS!  NOT A GOOD GAME!
privacy or information leak,This app really do be vibing doe. Do you like: Governments stealing your data ? Bad jokes ? Worse dancing? Cooking videos of food that youll never actually make ? Then this app is the one for you
privacy or information leak,Hundreds of photos are all fucking missing
fail to login or register,"What crap? The account and password are right. They can't log on at all. Hundreds of photos are all fucking garbage	"
permission abuse,Required access to my photos and media and "other" files?!?!  No Thx. UNinstalled.
ad disruption,Hate that it contains adds.
fail to login or register,It's good but I have a android and it will not let me text on there anymore i uninstalled it and installed it but I still will not text. I can't update it all either l.
bad performance,"Hlo tiktok team I have a problem with my tiktok account. I deleted tiktok and reinstall tiktok i think the problem was solved but when I open tiktok,tiktok show us ""No network connection"" but the network connection of my phone is very good and I have wifi also,when I signin my account they show no internet connection please solve this problem. thank you."
fail to delete,"Without a good savings card, you can't delete the information, upload and save it	"
app repackaging,"I have cracked versions of many languages	"
bad performance,"Grass mud horse this is the most card app I've ever seen	"
fail to start,App would not load on my Galaxy S6 edge thumbs down.
fail to login or register,Will not let you log in. Keeps opting to reset app but will never let you in
fail to delete,"fuck you!!! can't unload	"
fail to start,"Can't play this game!!!	"
fail to delete,"It cannot be deleted	"
fail to start,"As soon as you enter, the screen will be black, and finally return to the desktop! not fun!!!!!	"
fail to login or register,"I can't receive the verification code at all, cheat my feelings and waste time! Junk software is disgusting. People don't want to give it a star	"
payment deception,the installation fails after paying for it.
fail to install,"Shit, the installation fails after paying for it, lying beast	"
privacy or information leak,"All the bad photos are gone	"
virus,"Pit father fake virus	"
fail to retrieve content,Has never been able to connect to my gear.
fail to login or register,Wouldnt let me sign up
vulgar content,Awesome! Needs some more creepy eye effects and that vignette one but other than that....perfect ?
vulgar content,Some of these are really creepy and some are not.I love it but it needs more scary storys
praise,because the app looks so much fun!! So five stars before using it
privacy or information leak,"Hello everyone, I let you know what makes me want to install the app for first time ,but I never used, The videos that i can watch, But i thought the app want me to add videos to,. So I know that is not necessary to use the app I'll try again."
drive-by download,"i want to install it only, but it will ask me download another app."
fail to login or register,"Why can't email bills be synchronized all the time? Why can't you log in	"
fail to login or register,"Shit, the garbage game can't log in. It says my QQ password is wrong	"
permission abuse,"what the hell! Nima's! You need root permission!	"
payment deception,"**You know how to deduct money**	"
vulgar content,Tic took is awesome but just remember to watch out for creeps
fail to retrieve content,"My phone can only run when the network is disconnected. If it can't be saved, it will be blank. That's because you set it, it's not the original setting. Just enter it again and save it	"
inconsistency between functionality and description,"Barely useful, for the first year. Inconsistent and requires website use still. Cannot modify your garage from the app."
ad disruption,Annoying with advertising
app repackaging,"After all, the online version of the cracked version is more awesome than the official version. After all, the official money needs to be played out a little bit, and a soldier can be killed with a little carelessness. That's all money. 50000, one is still the initial one. Don't mention the top 51. So, it is recommended that the game be cracked. The game is not in the middle stage. There is a pressure to hit the gold coin later. Because even if it is not dying, every time the task comes back, it's all residual blood to defend. It's not good. I'm not satisfied with my blood every hour	"
fail to retrieve content,"That's enough. When it's released, it's blank when it's done well	"
privacy or information leak,this software is in danger of divulging privacy 
virus,"When scanning for viruses, this software is in danger of divulging privacy every time. It's not easy to use	"
app ranking fraud,"In order to brush the questions to comment	"
app repackaging,"The game is very fun, but it has not been unlocked in China except northeast Xinjiang. You can log in to Google account with VPN to locate simulated GPS abroad or play cracked version, but at present, only apple and Android have not been cracked	"
fail to retrieve content,like everyone else..... 404 error. waste of space
ad disruption,Hello annoying ads. Useless. Freezing my phone every 30 seconds. HATED IT.
fail to login or register,It was only showing me my math when i logged in
app repackaging,"We warmly look forward to Nike's official entry into Baidu Post Bar, cleaning up pirated and selling spam information, and rectifying the Nike spirit and Nike products recommended in Nike post bar	"
fail to retrieve content,stupid 404 error
privacy or information leak,Is this collecting users' private information in the background
illegal background behavior,Is this collecting users' private information in the background
fail to install,"The software will read the list of installed applications, otherwise the cloud card cannot be installed. Is this collecting users' private information in the background? Please give an official reply	"
vulgar content,you can do sooo many things there may be some creeps but just BLOCK them
fail to delete,"It's OK to use. It's just that the record cannot be deleted after measuring the moving distance every time. It's not good to start measuring the moving distance from the last time when you start measuring the moving distance next time	"
vulgar content,"This game is too cruel! bloody	"
drive-by download,I tried the game for my little sister and when i tried it the game told me to download the other game and my sis got very disappointed because she likes my little pony too
fail to login or register,Tells me theres an error when logging in. Please fix
vulgar content,Love but if you put your number for signing in people text you sex things
fail to login or register,Cant even create a log in account.
fail to delete,"Can't uninstall? What's going on?	"
fail to exit,"Excellent UI. Easy to use and sync to gmail. Events and tasks all at once. Since the last update on Feb 13, 2020, this app shows video ad. after modify calendar which you cannot close until the ad is finished. You have to be careful if you are in quiet environment ie meetings."
privacy or information leak,"This junk software is used to cheat information and upload the address book. Unexpectedly, it also requires to enter the bank card password, mobile phone password, online banking password and so on. I regret registering my mobile phone number and sending spam information every day. Fortunately, other passwords are afraid to fill in	"
vulgar content,This app is amazing there are creepy 12 year old boys but thats not too good problem. I LOVE THIS APP and I find it so entertaning .-- A random user BEST APP EVER
illegal redirection,"What's the situation when you go in and need dozens of points to move? Not memory	"
bad performance,"Under normal network conditions, most of them can't open the bus code and don't want to give it for a star. Use huihuawei wallet lingnantong bus card. Using this app will delay your travel to a certain extent. Don't blame me for not reminding you	"
privacy or information leak,"19 yuan! I don't know if it's safe! It is possible to disclose personal information!	"
fail to start,"I'm just that the user is not a water army. It's easy to use. Generally, he needs money to buy 50 beans. It's easy to use at the beginning. Slowly, you will think that this application can't be opened in the game of sucking money. Is it useless to restart or open the input method?	"
fail to install,"Why can't you install it	"
fail to exit,"The game cannot exit	"
fail to delete,"It can't be used or deleted at all	"
fail to install,I loved this app until my Google account started deleted it one day and won't let me download it. ?
app ranking fraud,"It's about to be updated. In fact, it's a game honeycomb. The five-star praise is all brushed. It's disgusting to send it. What software is this? What are the five-star comments? The page is concise	"
fail to install,Show me but I made a mistake and deleted it but it won't install can you let me please install the I love it so much
bad performance,"too slow navigation, wrong location. So bad app"
payment deception,There was no ADD CREDIT CODE box under Payment for me to copy the code into.
praise,"Don't have virus!!!	"
fail to login or register,"Login failed!! One of the authentication information is three logins. Please login!! What's the matter? The mobile company can't even fix it. What's the matter	"
drive-by download,The app is Good but when i delete it to free up space its not letting me download it me get it back... It keeps saying that if i should send a feedback but i know ya'll get a lot of notifications per day but overall its a very good app and 2. I recommend my stuff and they give me the opposite like i registered and asked for gaming and motovehicles and it giving me people dancing even tho i dont like dancing so please fix it up and give more options for editing videos like how capcut. Love it tho
permission abuse,Please tiktok give me permission to do live
illegal background behavior,probably collecting data.
privacy or information leak,probably collecting data.
ad disruption,Lot of advertisements... Awful app.
ad disruption,Makes the screen go black or constantly opens ads. Do not download!!
fail to install,"Installation failed. The update package is unsigned	"
excessive network traffic,"If you haven't tested, don't blindly send a new version update, but you can't use it! Is this a trick to cheat mobile data? What do you think	"
permission abuse,"open the root permission, the primary school English teacher must strangle me! Some of your comments are losers! I don't want to give you a star"
drive-by download,"There are bundled software, namely rogue software! Uninstall decisively! If you really want me to understand (noroot) as: "
privacy or information leak,make sense for the advertisers to get you and your contacts info Bogus
fail to install,"I haven't used it yet. I don't know how safe it is? The impulse value is a little cumbersome	"
app ranking fraud,"Rubbish! This software is all entrusted to praise! Rubbish! Rubbish! Kill the whole family!	"
app repackaging,"You can be shameless, but you can't be so shameless. It's purely a pirated Pokemon, and you brush your blood very high	"
payment deception,"Arbitrary deduction of fees by rogue software	"
ad disruption,Full of ads fake
fail to install,I LOVE IT BUT IT GOT DELETED TRY DOWNLOAD IT BACK CANT GET IT
payment deception,It sucks and charge you
fail to install,"I know Android phones can't install this, so I bought an Apple phone	"
fail to install,Before it's a good app but now it's stopping at 53 and won't let me download it
app repackaging,"The cracked version under Xiaomi mall, but the penultimate car was upgraded to the full level, and finally unlocked the Daiwa to play in Japan	"
payment deception,I hate this mode you have to pay serily
ad disruption,they put ads after every single click
privacy or information leak,"Easily one of the WORST apps I have ever seen, totally unusable because they put ads after every single click, literally!   The 5-stars are clearly from a ""click farm"", done by some poor people in India or China. This developer is a total scumbag, this is the type of software that later turns out they stole all your information or hacked your phone.  I would give it 0 stars if that was an option, WORST EVER, watch your data!"
praise,Tick Tock is a very nice app you can do videos of your only can watch other people's videos what what are there are their names at Tick Tock and then you search them and then you see they're funny videos it is a very nice thing Tick Tock is is delightful every people loves it even my friends it's cool they say that they have a day have a day have they have it I had it before but then I deleted it by mistake now I can't download it so sad and I'm missing all the videos Tick Tock is fun I love it
ad disruption,Too many ads Hated it
privacy or information leak,It won't let me download my pictures
ad disruption,Not so good.. too many ads
vulgar content,I love it even though there a lot of horny 6 yearold girls and boys on this app
excessive network traffic,"Fake goods that cheat mobile data	"
fail to start,"Can't open or find junk software	"
excessive network traffic,"Horizontal trough cheat data flow	"
fail to delete,"Why can't you delete it? I remind you not to download it	"
virus,"Bug toxic	"
vulgar content,"Tik Tok is a app that is for dance, talent,and other and it doesn't matter what's ur sexuality"
vulgar content,Tik tok is great it is a good app especially now that ppl who are racist are being called out on there its a platform for ppl to get away from there problems #pray4tiktok
virus,"No, I don't want to give it to the star, and there's a virus	"
fail to install,"It can't be installed after playing	"
payment deception,"Garbage is a lie. I have no way to complain for 100 yuan!	"
inconsistency between functionality and description,"The map is different from the picture	"
fail to start,Could not work it. Need english only saw chinese writ in ng
privacy or information leak,"A bunch of stupid software forced to update. All the negative score data of stupid software are gone. What do these software developers think? Are their brains arched by pigs	"
fail to install,Wonderful app but why won't you let me install this app
bad performance,It's also an absolute battery hog.
inconsistency between functionality and description,This app can't go 5 minutes without crashing. Notifications are inconsistent meaning you won't receive them every time. The list of matches can get confused and swap profile thumbnails so at a glance you think a different match replied. It's also an absolute battery hog. The only redeeming feature is the pool of people who use it.
fail to login or register,"Sb software can't log on and update the card	"
ad disruption,Used to be a fun and easy to use app but now it shows too many ads and it wont even let me post the link on my Snapchat story. Not happy!
fail to install,"Fuck Tencent, you can't afford to update and install	"
bad performance,It takes up the most important memory.
virus,"Garbage is nothing. It takes up the most important memory. There is a virus!!!	"
fail to retrieve content,"After the first installation, you can use it. Later, you can't open files or create new blank documents. You can only start the software	"
ad disruption,ads almost had me crash. Warning. Uninstalled
app repackaging,"Do I have a Chinese version or a cracked version	"
app repackaging,"There is a cracked version	"
bad performance,"The interface is simple and often stuck. It's good, but it doesn't seem to run in the background	"
payment deception,"What a mess of money	"
fail to retrieve content,Keep saying 404 error
fail to install,"Why can't I install Google play service	"
fail to start,It says open cv not initialized properly and app will shut down
illegal background behavior,"Download and run by itself	"
excessive network traffic,"Download and steal data traffic by itself	"
virus,"There is a virus: Look	"
fail to install,"NND can't be installed	"
fail to install,"The current Android version can't be used. I need you to understand. I don't know how your version is?	"
vulgar content,lots of gays and abnormal persons
payment deception,You have to pay your gay and retarted
fail to install,"Unable to download and install	"
excessive network traffic,"What does it mean to cheat mobile data when the network updates resources abnormally! How can you explain to the majority of players! Pit goods	"
fail to exit,"It's a pity that I can't quit	"
ad disruption,Ad is f... Irritating
hidden app,"The software is really good, but my mx4pro icon is always missing	"
privacy or information leak,"Like vine, but better affects. Also it doesn't steal info like Facebook or Instagram"
vulgar content,"It's great for what it is, however I do wish more of the discriminating content was removed, and the very inappropriate predators that use the app to push their sexual fantasies is quite gross. But most of the content creation that happens and that I see is quite amazing and we'll thought out. Pros: Enjoy hilarious content at your finger tips (just like vine) Experience great communities and wonderful people Create funny videos to share with the world I wish this allowed for more typing"
app repackaging,"Originally, you may not install the official version, but the cracked version found on the Internet. After upgrading, of course, it is upgraded to the official paid version, but I don't believe this fortune telling thing	"
vulgar content,"Would love to see a cleaner, Tic Toc with sub-categories that allow us to avoid corruption, vulgar input, sexual preditors. There are many young ppl. here, and the pervert and abusers are running a mock. I'd love to see this broken down into workable categories that people can select, should they not want to be subjected to the rhetoric, abuse, and mis-behaving posters.. tic toc won't last long and won't continue if this continues to florish all together."
fail to install,"Can not install depressed	"
praise,I love this app is have had it for a long time but I have been deleting it and re downloading it because I can never leave it ? so I have knaves this app and used it and had it for about 3 years or maybe 4 that's how much I love it. I'm really sad that the old owners decided to sell it to another company and change it but the new owners really made it better by every single update
illegal redirection,"Don't believe that the couple links are fake, just ordinary friendship links"
payment deception,"All the garbage is spent by Taobao store to cheat the toll. Don't believe that the couple links are fake, just ordinary friendship links	"
fail to install,"If you can't install it, just download it again. I've tried	"
permission abuse,"It's not easy to say that you don't need root permission, but you still have to use all the functional areas after root. There is a conflict between the screenshot and the suspension button. When saving to the SD card, there is obviously a jam, and the pixel of the picture is too low. I hope the improvement is OK, that is, there is no advertisement	"
payment deception,"I have to unload my credit card and charge a handling fee! Say goodbye to 51! Who would use such an app!	"
app repackaging,"China Education Commission thief Edition	"
app ranking fraud,"I feel these comments are brushed	"
fail to login or register,"Why can't I log in if I don't log in for a while	"
fail to login or register,"What game can't be logged in at all	"
fail to start,Stopped working after update only received alerts to reset app. Previous versions worked properly.
drive-by download,"There are too many bundled plug-ins installed	"
excessive network traffic,"Stole a lot of mobile traffic from me and cried to death	"
drive-by download,let me tell you something there is bundled software installed 
permission abuse,Mine says that it need permission from the camera so the app could work. I already fixed it on my setting but it's still giving me the same error.
app repackaging,"Not bad. Crack it elsewhere	"
fail to start,Does not show my media folders and what files that I could find would not allow playback and then crashes file. Complete garbage of an application.
bad performance,"The garbage card is terrible. Originally, my mobile phone didn't have a card	"
fail to delete,"The horizontal trough cannot be unloaded!!! After uninstalling, restart it immediately and it's still there! What junk software!!!	"
praise,"The virus is fake. Don't worry	"
fail to exit,The app will not kill dead.
illegal background behavior,The app will fall down in the background and will not kill dead. It will stay in the background and arouse the baidu application
bad performance,"After installing this application, the small 6 battery life will directly collapse and the fuselage will heat up. You can fry eggs. The power brush will fall down in the background and will not kill dead. It will stay in the background and arouse the baidu application to run. The measured small 6 battery life will return to the normal level one hour after unloading	"
bad performance,"It is too laggy.	"
fail to exit,"Shit, you can't quit yet!!!	"
fail to login or register,"When querying the credit investigation report, it always prompts that the verification code is wrong and can't be logged in at all	"
vulgar content,"Don't use junk software for violent loan collection	"
