fail to login or register,"Really * * I don't want to log in at all	"
fail to login or register,"After the social security is stopped, you can't check the social security if you can't log in to the social security website	"
vulgar content,It's very very good ready to five star but there is some stuff you can fix by banning tick tock accounts that have nudes but other than that it's really a good app
fail to start,"I can't open anything here	"
payment deception,Paying for a stupid map rip off
vulgar content,it is amazing but creepy to
app ranking fraud,"At most, I only give four stars. I don't know why the software scores so high. Hundreds of comments or five stars? Look, the icon of the software is in Japanese. I thought the Japanese content is very rich. As a result, the Japanese language is not even marked with pseudonyms, and the translation is not complete	"
fail to login or register,"This app wouldnt ever register my email and i tried a few different ones. Seems highly faulty, a shame i was looking forward to trying it but if there software wont even allow you to create an account then it truly shows the lack of any if all support it has/had."
vulgar content,Nice app but don't use children it's very sexual app
payment deception,"If you don't pay attention, you don't know why you don't get the phone bill. You still can't unsubscribe from eating Coptis chinensis	"
fail to install,"Unable to install what signature inconsistency between functionality and description	"
bad performance,"BOC Credit Card app disgusts me	"
permission abuse,"Its great!, expect the problem comes when we need to grant permissions . but anways its very great It deserves 5-stars"
app repackaging,"Shit, I'd better play my cracked version	"
app ranking fraud,"Invite a gunman to brush the praise and cover up the fact of your software garbage? I'll just hehe. Garbage is always garbage. It's still rubbish to invite a gunman to brush it! Junk software doesn't explain... Don't be fooled	"
payment deception,You literally have to pay for almost everything. Honestly this doesnt even deserve one star because its a scam.
ad disruption,Sucks..everytime I push check it goes to a commercial. Your app is the worst app ever. Sucks is a understatement
ad disruption,"This is ridiculous. Everytime i try to type an emoji an ad pops up and covers it, this is so freaking stupid"
fail to login or register,"You can't log in at all	"
fail to start,"Hey I don't know if it's just my phone or a problem with the app, but it's suddenly stopped working, as soon as I turn it on it shuts itself down before I can do anything, been happening for over a day now, I've tried restarting my phone and deleting and re installing it but still the same issue"
permission abuse,"At the beginning, I asked to fill in the mobile phone number and input the verification code, and then all kinds of telephone harassment. Now after the update, I asked to accept SMS GPS precise positioning. Is there too much authority for this requirement?!	"
drive-by download,"It's too bad. It's not easy to use. The photos are deformed. There's also a grid inside. It's not beautiful at all. I suggest you don't download a star. I don't want to give it. I'm forced to download a small video of volcanoes	"
payment deception,"Uhh... Soo.. Need money hr! Idon, like it its soo disgusting And soo not cool!"":-("
fail to retrieve content,Never connects to the network. The app needs some work
fail to install,"Not installed	"
fail to install,"Always prompt to update the latest version, but it cannot be installed after downloading	"
bad performance,"The software design is not simple at all. The power consumption is always asking you to turn on WiFi. The typical person with a pit in his head is really ill. If he doesn't earn some living expenses, I don't want to use it. It's too different from meituan crowdsourcing. Meituan's software is easier to use because its unit price is low	"
vulgar content,I love ? it until tiktok shows their liberal democratic side and takes down our Trump 2nd amendment videos but leaves up the perverted ones and such
privacy or information leak,"Fuck my hard-working files are gone, Keng dad's software wipe complaint!!	"
bad performance,"When I use on my BlackBerry Z30, every time I try to use it crashes."
fail to login or register,"When I use on my BlackBerry Z30, every time I try to login it crashes."
fail to start,CRASHES AND SUCKS
fail to login or register,"I can't log in today, either	"
fail to install,"Can't install what ghost?	"
fail to delete,"You can't delete a bad comment on a post. You don't want to give a star. The content is not good. It's not fun at all	"
excessive network traffic,Trick flow
vulgar content,It's a good app you can do anything but be careful of creeps it's a good app I have alot of followers
privacy or information leak,"There's nothing wrong with this slag software. The data is wrong. There's no disgusting bad comment on the comics	"
ad disruption,Do not like the lock screen ad
drive-by download,I love this app ? it's so fun and creative and my kind is on there to (cosplayers) ?. And it's so fun to watch to ?? I give it a 5 star. It just won't let me download ?
virus,It says my phone is infected by virus when i was web surfing
fail to login or register,"QQ login can not buy for free	"
fail to start,Crashes on Google Pixel
inconsistency between functionality and description,"When trying to log in, it constantly tells me, oops something went wrong please try again when trying to log in with both phone number and through facebook. App is very inconsistent then also sends notifications but still can't get into app. It doesn't work properly so don't waste money on premium version. Fix the basics and maybe we can get somewhere"
privacy or information leak, We can't control our privacy!
fail to delete,"Please don't use it if it's useless. It's a serious security hazard! Card records, bill records and credit investigation records cannot be deleted! Baidu introduced that there is a delete button at the bottom of the bill details. I don't know when it has been cancelled! Log in again after deleting cards. All cards are managed in hidden cards and cannot be deleted! E - mails are deleted, indicating that our data will always exist in the server of 51 Credit account cannot be deleted! We can't control our privacy! 51. What's your intention? Spread!	"
praise,"Very good, I like it! No card, no Trojan horse	"
payment deception,"The contents of deceptive software are all from other software. After half a year, 100 yuan will expire in two days	"
praise,"This game is poisonous. Once you play it, you can't stop, but it's a pity that it's buried	"
bad performance,"Once uninstalled, it will shut down and restart"
fail to delete,"This is a black hole. It can never be uninstalled. Once uninstalled, it will shut down and restart	"
privacy or information leak,"The repayment limit is too much. You can only use it once a month to watch the repayment expire. The keyboard of the customer service interface blocks the input box for typing and error correction. It is extremely inconvenient. The ID card, bank card, mobile phone number verification code and mailbox have collected too much privacy data	"
bad performance,Worst app ever. Keeps on crashing minute after minute and rendering movie doesnt proceed after 25%
virus,"Spam virus software	"
fail to delete,"How to uninstall meow? You don't want to give it a star. You can't uninstall it	"
vulgar content,I love it and it do not have sex but it do it for christmas or anything but it doesn't mean I love you and it
praise,"Why is the software safe with such a small comment	"
fail to login or register,Worst response. Not able to receive SMS for creating account even after 8/9 attempts.
payment deception,Will not let me pay with my masters card!!!!!!!!!!stupid stupid STUPID!!!!!!!!!!!!!!!
app ranking fraud,"Praise is brushed out!	"
fail to install,"It's not good to install it. I can't think of a series of articles, but I can't send characters. I don't want to go back and forth!	"
fail to install,"What happens to 210004 when the installation fails	"
fail to login or register,Will not let me sign-up keeps popping up no network error
app ranking fraud,"Why are there so many good reviews? I was flashed back as soon as I downloaded it. I don't know if so many good reviews were brushed out	"
fail to install,"It can't be installed at all	"
vulgar content,Tons of child porn needs to.be taken down now
drive-by download,"Too many binding software	"
payment deception,"Prices are always off and the new update makes it nearly impossible for anyone to find their vehicle do not rely or depend on this app or site you will.over pay on your car no if ands or buts coming from a 21 year dealer just a heads up. And back to the update some things when simple but works, STILL WORKING SO WHY CHANGE ANYTHING! ?!"
vulgar content,"I have not personally seen the dark side of tiktok people are talking about. My daughter told me her boyfriend and her were flipping through it the other night and seen a toddler trying to _______ his mom!!!!! Wth??? If I seen that believe me I'm reporting anything bullying, racist or abusive."
vulgar content,This is amazing an talented people on here an celebrities amazing right cardi b Charlie demilio and Dixie demilio lil hudd famous singers an funny an creepy and you can make your own tick tock videos you can put them on drafts or you can put them on post drafts mean that nobody can see it post means that everybody can see it and like post share comment like followers you following smart kids smart everybody talented people a lot coloring creepy stories waxing makeup story time makeup story time.
vulgar content,Tiktok is nice but you should keep it fair. Blacks don't get as many views as whites. And you allow a lot of white supremacy on your app. Instagram does not allow that you have time out for things that are not necessary. I've been blocked about five times for defending myself against a racist..
fail to start,It doesnt even work !!
payment deception,Bad app..removing ability to make payment from this app and needing another app to make this payment is dumb.
payment deception,"My relative's mobile phone tail number 57 has been exchanged for a 50 yuan call card. Both the order and customer service have been successfully recharged. Why didn't I recharge it?	"
fail to install,"The prompt program cannot be installed. This program is bad and can be used in the front market	"
ad disruption,"Does Not Work, tons of ads."
vulgar content,I LOVE IT...works 100% its a very good app It is my fav app I highly recormend it but as it says 12+ there is sex stuff and cuss words but not that much
ad disruption,Dull gameplay plus too much ads
virus,Gave my son a virus
app repackaging,"There will be many cracked games in your next 7723 game box	"
fail to install,"Whether the upgrade has not returned the version number or changed the signature. The endless cycle upgrade cannot be installed	"
privacy or information leak,"What's wrong with the sudden loss of information in my and notes? How can I find it? emergency	"
fail to delete,"After the online banking login information is added, it cannot be deleted! I can't understand! No one dares to use the most basic sense of security! Look at the online banking direct connection information in the card cow data source. You can add or delete it at will! As an old user, I've been waiting for official optimization for so long, but I haven't changed the feedback, and no one pays attention to it! If the financing party has been kidnapped with us $400 million, what will it do to make money! We should know that those who get users have access to the world. Water can carry a boat and capsize a boat! If you can give 0 points, you must give 0 points!	"
excessive network traffic,"It's a big liar who can't log in to cheat mobile data	"
drive-by download,"The game is good, but the bundled software	"
virus,"The mobile phone virus is a high-risk program that has been killed	"
fail to login or register,"Only the horizontal screen verification code is blocked, and you can't log in at all. That's bullshit!	"
ad disruption,"Ads, ads, ads and ads"
ad disruption,To much f****ng advertised
excessive network traffic,"Garbage game! cheat mobile data! It can't be installed directly! I don't want to give half a star!!!!!!!	"
bad performance,"1. The regular QR code does not show that the network is unstable and slow, affecting the efficiency. 2. There are only one or two special code scanning machines at each subway entrance in Guangzhou. Not when each exit has input, the card swiping channels are not connected together. Shenzhen is integrated. When Guangzhou goes south, there is only one code scanning machine at six or seven subway entrances. The app developers and equipment operators are the same Someone with a hole in his head?	"
payment deception,"This is useless, wanted to pay for the game,  your support mails does not work. Make sure you refund"
vulgar content,"Very, worst app. I have never seen such app in my entire life. No sex videos, no explicit material. No nude content. This is such a disgusting app"
praise,"Very good, I want to find a software to brush questions according to chapters. This is very complete and has analytical praise!	"
ad disruption,"It doesn't work to block advertisements after the update	"
virus,it's good but it gave my phone a virus soon it's a warning hehe
permission abuse,"Some games need root permission, such as subway Parkour	"
fail to start,"Downloaded, installed and set up. What does it mean that it can't be opened??????	"
fail to delete,"Why does every uninstall prompt that the uninstall fails? The available memory size has not changed, but it is not in the uninstall list	"
fail to install,"It cannot be installed on SD card at all	"
payment deception,"Junk software costs 50 yuan a month without a few words. Don't download it if you cheat	"
fail to delete,"If you forget your password, you can't delete it. Why	"
vulgar content,its soooo good..just watch out for creeps ao u might wanna have ur page on private
vulgar content,"This game is poisonous. People on our side are watching it foolishly!	"
vulgar content,I love it a lot ?but if your kid is not a T.E.E.N your kid can be cat called . ?not a good idea . sexually assaulted . because my sister has been told that put your shirt up and also . can you do a hand stand so that their shirt can come up so adults if you don't want your kid to have Facebook page don't get this?it only for your kids safety first but it is a great app.???????????????????
ad disruption,full add
fail to start,Its not working after the update !
fail to install,"ZTE u930 cannot be installed	"
ad disruption,"The dregs are all advertisements	"
fail to install,"Installed and unusable	"
inconsistency between functionality and description,Not true to what advertised. No different than filters on your phone
fail to delete,"It can't be deleted!!!	"
fail to start,"I don't know how to start when game is installed	"
fail to start,This app crashes to much
fail to start,Not working please fix it
inconsistency between functionality and description,"The exchange items are different from the physical pictures. It's too rubbish. It's recommended not to exchange them. The quality is too poor. It's recommended to exchange cash. The customer service doesn't pay attention to the feedback	"
excessive network traffic,"Half a week without internet access, wasted Internet fees and bought a lot of traffic!!!!	"
bad performance,"My Wuhan all-in-one card can't be read. You can use NFC life pass software	"
ad disruption,Terrible app. Way too many ads.
vulgar content,It always makes my day. But there are some racist and not funny jokes on there but 99 percent are funny and enjoyable jokes.
fail to login or register,"I can't even get on, but I can hang up and turn the experience dial	"
fail to start,"Why can't it open & hellip;	"
ad disruption,"Advertising is a headache	"
fail to start,It keeps saying it stopped wotking
payment deception,It worked twice the started having problem especially after I brought the app.  Sad story feel cheated. Careful where you spend your money
illegal background behavior,software always run in the background
praise,"Useful. Those software that always run in the background are banned	"
fail to login or register,Would Keep Saying No Internet Signal and not let me sign up
bad performance,"The mobile phone crashes perfectly~~~~ (>_<)~~~~	"
bad performance,"Card machine	"
drive-by download,Let you download his game
payment deception,"automatically send text messages in the game inexplicably, and deduct 10 yuan"
illegal redirection,"Let you download his game, play it for 3 minutes, activate it for free, and then automatically send text messages in the game inexplicably, and deduct 10 yuan	"
bad performance,"Millet note often crashes	"
payment deception,"What kind of dog JB thing bucks money	"
vulgar content,"It's pretty bloody	"
drive-by download,So um... basically i hv the normal tiktok...and its annoying because it keep on deleting my vids? So yea i downloaded TIKTOK+MUSICALLY!!
virus,"Bad garbage has virus	"
fail to delete,"It doesn't take up much memory, and there are garbage plug-ins that can't be deleted	"
fail to start,Keep stopping
ad disruption,No movies at all just trailers and a million ads
fail to install,Plz fix it us not letting me install it for some reason but the app is very good but not the people really
vulgar content,so initially I thought Tik Tok was a kid app I downloaded it for my kid however I must say that I truly enjoy sex. I have learned quite a bit from Tik Tok and I'm learning more everyday met some nice people interact with some people I know but are far away I like to talk
illegal background behavior, garbage software run in the background
privacy or information leak,"Data is easy to be lost, and garbage software cannot be run in the background	"
fail to login or register,"If the verification code can't see such low-level mistakes, it will also make mistakes. The engineers outsourced by ICBC are really hopeless. It's sad that the PC version of postal bank has a bird like computer display that is not 16:9	"
fail to retrieve content,Only white screen
permission abuse,"Samsung Galaxy Tab E with Nougat update will not give permission to enable USB OTG with this app, other option needed"
ad disruption,Riddled with advertising that it is hard to actually use. Gone are the days this was a useful app.
fail to login or register,"I don't know if I can withdraw cash and install it for three days. It's very difficult to use. I can't sign in. I'd better unload it	"
praise,"Although it is not perfect, for example, it is impossible to import online banking of Ping An and GF, there is really nothing better than him	"
virus,"Dead garbage rampant virus software	"
fail to install,Amazing this is the greatest game it won't let me install it though
fail to install,"The update can't be installed... What's the prompt for the update	"
fail to start,Is not working
fail to start,"It's so bad that the screen is black as soon as you go in	"
virus,"It's not fun. It doesn't have the nature of badminton, and it will download and install indiscriminately. The original price is toxic. I don't want to give it a star	"
payment deception,Why do you HAVE to PAY?It is supposed to be free!
bad performance,"Cards sometimes don't make people vomit when they're angry with the card machine	"
app repackaging,"It's a pirated pop pong	"
fail to login or register,"TikTok is awesome app, its give me alots But there is getting some problem in login to my tiktok account. Actually I forget my password and try to change my password with help of my gmail account but 6-digit opt n.o or message not sent to my gmail from tiktok. So plz help me what to do, how to login, plz help me? I don't want to make new accounts nd all, plz help me in login and how to change password plzz????"
bad performance,I was using tiktok for many months in new update my phone being slow so i deleted and when want to reinstall .it will download and gives me a error evertime (can't install tiktok) kindly fix this problem or give me some suggestion Thank you.
ad disruption,To many ads. Cant find anything out without having to go through so many ads to get through it
ad disruption,Wat is it with all the ads the setup is so dumb just change it
fail to login or register,This app wont let me pass the sign in page
inconsistency between functionality and description,Not the same as advertised
ad disruption,It sucks cause I rather watch and ad for coins than use my own money
virus,is it virus infected app??
vulgar content,it showed filters like being able to make your face on fire
ad disruption,"The ad video was on a game, it showed filters like being able to make your face on fire, ect, the video wasnt realistic."
app repackaging,cheating apps
ad disruption,cheating apps that only show advertising to collect money
permission abuse,"I want this, but its so many permission just to fit this one app on my phone. I have to erase many more apps."
virus,"Is February 24, 2017 toxic? Obviously, it is an anniversary day. It has always been shown that the mobile phone has been restarted many times in the countdown day of February 24, 2019. There are such bad comments!	"
praise,best thing i ever saw in the world keep it in the app store donot let anyone delete it if they do download it back
ad disruption,Not even withstand /keep it for two minutes. So many ads that could not even start the app. Unstalled it for ever
vulgar content,"It always has something funny, sexy or interesting for me, i love it!"
inconsistency between functionality and description,"It's a really inconsistent app now. Not the app itself. It's a user friendly interface. No complaint against the developer. My first-time in 2018, was pretty good. I matched with different ppl around the areas that I preferred. Chatted and dated. Now, there seems to be a very limited amount of users. I matched with close to a dozen ppl, though no response. Literally one of the ten initiated a conversation. She unmatched within an hour. I was at work. ???"
illegal redirection,"It's terrible after the update. You have to install plug-ins to play!	"
permission abuse,This is an amazing app but you need permission to use not to put you off but it does chew your storage up . FIVE STARS THOUGH ??amazing app !!!!???????????
vulgar content,"I really love this app this app is so funny ,sweet and sex my favorite app whole world ???????"
excessive network traffic,"Too bad what? Defrauding network traffic, it is recommended that you don't download too much	"
praise,"The software is very good. It can be recommended that the software containing score deduction trojan virus is also specially marked with 360 security certification. If it is really safe, how to contain Trojan horse; If you haven't certified the software, you can design deception. In contrast, you still trust 360. After all, it has been used for many years	"
ad disruption,I HATE IT BECAUSE WHEN EVER I PLAY OR WATCH SOMETHING ADS KEEP APPEARING
bad performance,"Why can't I play with the old card on my mobile phone!	"
vulgar content,It is awesome my friends have it and I get to contact with them and see the really awesome videos and the filters are great even the sounds even though it's creepy it's great even the filters one of them scared me to death I really really am a big fan of the sound and the filters they are the awesomest ones I ever seen even my cousin agrees with me her name is Emily Ortega she's one of the best I know even the Voltron cosplay does the best thank you I'm sorry it's long but but thank you you're awesome
payment deception,Its crazy i have to pay doe the app seriously
payment deception,U have to pay for it wat!!!!
fail to install,"Why can't I install it after the update	"
app ranking fraud,"Bad comments can't even be posted on the spam app	"
fail to retrieve content,"Last time I gave him a praise, this time he was shameless, and there was a blank after opening. It's fucking no face song. It's fucking enough	"
virus,"It's rubbish! It's rubbish! It's rubbish! It's the virus that took over my mobile screen. What the fuck is fixed screen bullshit! Uninstall uninstall!	"
praise,"Fast, easy to use	"
app ranking fraud,"Not at all. Praise is brushed, isn't it	"
payment deception,"Fake cheat you to spend money	"
fail to retrieve content,Does NOT load
illegal background behavior,App  hides  deceptively
payment deception,App  hides  payment  deceptively
fail to login or register,Keeps saying error when logging in
app repackaging,"If you don't have money to buy a car, you can have the next cracked version. Ha ha	"
drive-by download,It amazing I love you aroha it's Aali you you next time it is not letting me download it
vulgar content,App stopped uploading my videos I shared my nipple piercings it's not in a sexual manner it's a piercing on a body
inconsistency between functionality and description,very inaccurate
ad disruption,Worst app ever too many  ads and very inaccurate
excessive network traffic,"Traffic cheating game day	"
fail to install,"The download needs to be updated and cannot be installed	"
fail to login or register,"Why can't I go up there? It says & ldquo; You create the role of Locke & rdquo;	"
ad disruption,Full of invasive ads!
privacy or information leak,"It's very easy to use. It's just that there's no data after brushing the machine	"
vulgar content,Not enough banning of bots and fakes and pedophiles.
vulgar content,"??The program is nice, but there are racist people. Please solve the problem."
