ad disruption,To many mf ads.
praise,Also very cool that they don't bombard you with ads. 
excessive network traffic,"Bad reviews cheat browsing traffic software	"
fail to delete,videos in drafts should not be deleted after uninstalling the app ... otherwise fantabulous ????????
ad disruption,"Tried it out. I could never actually read an article, the pop-up ads are incessant. I just tried to read an article, restarted the story three times, the article was covered by three separate ads, just a waste of my time.  Could be a decent news source but the programmers need to cut out so many interruptions."
fail to install,"Why can't you install it... Cry~	"
ad disruption,"Crazy intrusive ads, tried to get me to rate in 5 stars immediately. Unusable."
fail to retrieve content,"Same as others. 404 error, useless app!"
fail to start,Downloaded on new phone kept freezin this app used to work awesome sorry for the one star but if it dont work then thats all it gets ..
drive-by download,Very good But it doesnt let me download it
fail to install,"How can I fail to install`	"
permission abuse,"It's really rogue software to refuse to use the address book without giving permission	"
vulgar content,Be careful there sre pedafiles in this world but you can have your account private but all it takes is a hack i syill give it fove stars people can also say things like this. You're so sexy and i love your body. there are a lot of really gross people so i just wanted to say be safe.
bad performance,"The latest version of the card exploded and can't be used at all. I didn't think there was such a card app in this era	"
fail to install,"The desktop is good, but it's unrealistic to install it again after a period of time. I don't know why my tablet is motoxoommz6013g version!!!	"
fail to start,Will not even let you do anything. The moment you start to navigate the app crashes
app ranking fraud,"Brush your MB comments	"
fail to install,I love this app but it wont let ME install it
fail to login or register,"When registering, the card failed to receive the verification code sent by SMS for many times. Up to now, it is impossible to register	"
privacy or information leak,"After updating my files, there is no garbage! Don't come out to harm people without this strength	"
fail to delete,cannot be deleted 
permission abuse,I very much like this app but in update versions i can't upload my sound thats why i have promblem and tik toh don't slow it i will uninstall app please give permission for own sound and give view of video
bad performance,"Experience it for 10 minutes every day. Go in and crash until the end	"
privacy or information leak,"What's the matter? Move the album video to another album to show that there are so many videos in the original album! After choosing to delete, all the videos are gone. Who pays for my video? That's all the videos my son has had since he was born! What the hell is this!	"
fail to start,I love this idea. But the app crashes every time with my Galaxy and Gear VR.
permission abuse,I have a problem to record video it asks a grant permissions
drive-by download,its not even letting me download the app
vulgar content,I love the videos of all the sexy guys dancing!! Wow!!
fail to delete,"I'm in a mood to say I can't delete it! Pit father What if you write wrong!! Hope to change	"
fail to start,it crashed
bad performance,"Fuck, I was supposed to crash perfectly for the 5100s	"
fail to install,"I can't even install it. It's down to my mobile phone. I can't use anything	"
ad disruption,Ads were only there nothing else
fail to start,"**The card is dead and can't be opened	"
fail to start,GetAdvertisingId @ line 49 is causing the app to crash.. android 4.4.4. ill re-rate if it gets fixed
fail to start,App does not work. Unable to check in to flights and shows flights as delayed when they are not.
bad performance,"I feel there's still something wrong. I'm glory V8. Opening palm gold information will clear the crash phenomenon_ Palm precious metal_ The app program data is restored to the original state. When the software can be opened normally, there is no problem. Closing the software and opening palm gold information will crash	"
vulgar content,I love this app.i found lots of sexy girls in this app
payment deception,"I didn't expect that China Unicom has so many more value-added services for no reason. It's disgusting to need software to unsubscribe. I don't know how so many high praise came from	"
illegal redirection,"I didn't expect that China Unicom has so many more value-added services for no reason. It's disgusting to need software to unsubscribe. I don't know how so many high praise came from	"
ad disruption,Ads make it impossible to use.
bad performance,Looks same as stock app and has less options.  Worst is still white-wash eye and battery killer design.
fail to start,"You can't talk, can you	"
bad performance,"Xiaomi 4 always crashes	"
virus,"Don't let the virus pollute the mobile phone. You'll regret it	"
drive-by download,I think that it is very fun but I deleted my downloaded tiktoks and I really miss them. Can u make an update where you can see all your downloaded tik toks and your old ones? I can't find my old tik toks and this would be really helpful thank you.
excessive network traffic,"Garbage deceives others to download, earn traffic, sign in and get less and less traffic. At the beginning, the traffic red envelope can be robbed more than ten times a month. Now it's five times. Grab it once next time. Garbage, go paralyzed	"
app repackaging,"Rubbish, this is the of pirated super warships!	"
fail to start,"Always a black screen, poor to the extreme	"
drive-by download,"they force you to download a new app, and call it an ""update"". and disable the use of their original app. so messed up f this"
fail to delete,"Unable to uninstall	"
fail to install,"OK I love tiktok but for some reason I updated tiktok now It doesn't let me download it it keeps saying there is a problem at first I thought it was storage so I deleted a lot of suff(apps,pictures etc)but it still says that I can't download it.?"
bad performance,"Let's get together. The mobile phone has a serious fever	"
fail to start,Stopped immediately after getting on it. Had good prices the only first four I could ever see
fail to install,"Android 7.0 does not support!	"
fail to delete,"The negative app cannot be deleted	"
fail to start,"not even works, good job microsoft"
app repackaging,"This app should be blocked,  cheaters"
fail to retrieve content,Nothing will load when searching for ringtones
bad performance,"I hate the level of shaking my mobile phone. The mobile phone shakes out the screen capture and the door doesn't open	"
bad performance,I really really love love this app tik tok and its very good and it really does MAKE MY DAY!!! But the only thing is that I have to delete it because its taking up to much space on my phone and yes I deleted all the things I could delete and every time I try to download a game or something this thing pops up saying delete the unessesary apps you dont need but mind you I litteraly have no apps on my phone downloaded it is very stressing but otherwise I really love tik tok thank you???
fail to install,"Android phones can't be installed	"
fail to login or register,"Why can't I go up and change several numbers	"
fail to install,"Why can't I install the game here? My Huawei glory 6	"
fail to install,"It looks gorgeous, but it can't be installed	"
inconsistency between functionality and description,"It's totally different from the cover	"
virus,This app sucks waste of time. Sends you to a website that sends virus to your phone. Customer service non existent. 100 thumbs down
vulgar content,Yes it might have pedophiles But its great! 10/10 100% Recommend
fail to delete,"What the hell can't be unloaded?	"
fail to start,It dont work
vulgar content,I like it but there is one thing wrong why did it say can you see the location good canbyou SAS me or something that is really creepy that is freaking me out a lot
fail to install,Android cannot install
excessive network traffic,"Traffic swindles large users and reloads every time you open the subway map	"
bad performance,"Dynamic doesn't work at all. The unlocking screen is static. I thought the card was jammed. It didn't move at all. It didn't move for a while	"
privacy or information leak,"The album is gone... I'm not used to it	"
payment deception,"Nima talks and swindles money suddenly	"
fail to start,Are crack
virus,"What do big spiders say is poisonous	"
excessive network traffic,"I9100 runs perfectly ~ ~ those who are afraid of secretly taking traffic can turn off traffic and play~~	"
fail to start,"Shit, it's too embarrassing for you to fight. Please don't go down. If you can't open it, I can't open it	"
illegal background behavior,Constant background tracking?!? No thanks!
fail to login or register,"Why can't you log in and prompt the account and password error	"
fail to start,"Millet perfect flash back	"
ad disruption,Added ads to my lock screen.  Removed immediately.  Never even used it.
fail to install,"Alas, why can't I install it	"
vulgar content,"funny sexy just a great time does what you want to see,Thanks alot for the update doesnt work anymore."
fail to start,App crashes every time I try to record. HTC One M9.
drive-by download,really bad to download the bundled software
vulgar content,Its a good app but innocent accounts are getting banned but theres accounts with nude people in and there not been banned :/
privacy or information leak,"Super hard to use! Steal personal information	"
virus,"Garbage is useless. You can't check the password, you have to press it yourself, and the WiFi password will disappear. Please don't download the mobile phone. Don't try it on. There may be a virus	"
fail to start,Not fun its not working
fail to retrieve content,App suck....all you get is error 404
fail to login or register,I CAN NOT LOG IN OR MAKE AN ACCOUNT! HELP PLEASE.
fail to install,"After the update, you can't play. The re downloaded installation package can't be refunded	"
vulgar content,Need to watch who is on the app as there are lots of creepy old men and lots of young children on the app and not much privacy
fail to install,"This software cannot be installed	"
fail to login or register,"Never change the mobile phone number. After changing the mobile phone number, the customer service can't solve this problem. The verification code for cash withdrawal and repayment is the original mobile phone number, and sometimes the verification code is required, and sometimes the verification code is not required	"
app repackaging,"Shit, don't download too tricky. Since there are only five songs you can play, you have to charge for everything else, and you also have a lot of traffic. I recommend you to download the cracked version online. As long as you send the data package to the SD card and install the cracked version of the game, you can play it. And it's great that all the songs are free and all the songs don't have to be downloaded. Make sure you don't need to unlock 456 keys when you play to the horizon What songs do you want to play to unlock this pitching game!!	"
ad disruption,Dreadfully useless and full of ads.
drive-by download,i want my drafts not to delete if i uninstall it once
app repackaging,"I told you, in fact, this software is a pirated game to imitate the sweeping zombie. You can go and see the sweeping zombie. It's much more interesting than this	"
excessive network traffic,"Mom's approval deceived me. Once the traffic goes in, you can't play anywhere on the browser. Keguabao, be careful not to download	"
fail to retrieve content,This app is no longer available
payment deception,I suggest you don't run in the paid version secretly in the future 
illegal background behavior,The software will run automatically in the background.
illegal background behavior,Why do you always run in the background secretly? 
privacy or information leak,Don't you know if I have some important information in it? 
excessive network traffic,"Why do you always run in the background secretly? Don't you know if I have some important information in it? The software will run automatically in the background. I don't know what to do. I don't know what to do. I suggest you don't run in the paid version secretly in the future	"
inconsistency between functionality and description,"The app gets five stars for having a good amount of women with quality but loses 2 stars for being inconsistent with notifications. There have been plenty of times when msgs would be sitting in my inbox unread because the notification doesn't always pop up to let me know it's there. also, I don't think all of my msgs are being received. I'd be chatting with the girl and the exchange of conversation was pretty fast but all of a sudden they would stop responding and I know it's due to the app."
fail to install,Its kinda good i love it .. Aarigato for such a app.. I cant say any furthur................but nowdays its not intalling ...it was delete from my mobile...so i tried to download it again ..but i count download..i5s saying cant download this app..??plzz repair it fast...
excessive network traffic,"It's found that this product has been stealing traffic from the background... It's useless. It will steal hundreds of M traffic a month... I don't want to give it a star	"
fail to start,Foes not work crashes wheb you try to open it
drive-by download,I love it but this int the account I have it on my tablet won't turn on make it where I can download and give his account to m it was mine.. my tiktok username is whyyoulookingatmehuh thank u?
permission abuse,"It's very useful to me. It would be better if I didn't have permission	"
privacy or information leak,"A swindler who steals personal information	"
fail to login or register,It wont let me sign into my account
fail to start,"Garbage. Most people are sad because it keeps crashing. Well dry your eyes people because it is running fine on my phone and I feel I have gained absolutely nothing from it. The brazil app was worthless too, but I was hoping for improvements. Unbelievable that they would bother to put out such a  useless app. Gotta run. I am going to post some automated virtual cheers for team USA."
fail to install,"Under the installation, I can't be angry!!!	"
app repackaging,"Aiwu has a cracked version	"
ad disruption,"Not at all accurate - unfollower list is full of people that are mutual followers. Every tap is an ad too, poor app."
permission abuse,"Garbage needs root permission. One software after another lets you garbage. Hum!!!! The risk of good temper being worn out brings back a lot	"
drive-by download,It won't let me download it but it's pretty good fun
ad disruption,Ads suck ass!!!
vulgar content,this app is mind blowing look comparison know anything it is mind blowing you can also make videos watch videos but don't apply sex videos videos on it because it is a safe app entertainment free download download rate post ok thank you and please get my order
privacy or information leak,"Bullshit, all the information is gone after the update. It's very rubbish! And I don't know what the product manager thinks	"
payment deception,I hate it because you have to pay
inconsistency between functionality and description,"Don't be a liar! Why not say in advance that it is not applicable to this machine before downloading! Lie to me. NIMA forced it	"
excessive network traffic,"Don't be a NIMA liar! Why not say in advance that it is not applicable to this machine before downloading! Lie to me. NIMA forced it	"
vulgar content,"While I love this app there's alot of issues on here and in 2021 I'm amazed by it. I've never seen so many racist disgusting people, from all sides, in one app and I think that needs to be recognized. It's a shame so much hate"
privacy or information leak,"There's nothing after the deceptive adjustment. Don't believe it	"
bad performance,"The software is too bloated. The mobile phone is stuck!	"
fail to install,Plz let this app right install
virus,"Well, what star coins are always poisonous	"
permission abuse,"No, you need root permission	"
privacy or information leak,"Wow! Really invasive permissions for a weather app. Spyware. Take pictures and videos? Whatever for? Read, modify, delete the contents of my SD card? Reroute calls? Identity? Anything else? First born? Uninstalled."
permission abuse,"Wow! Really invasive permissions for a weather app. Spyware. Take pictures and videos? Whatever for? Read, modify, delete the contents of my SD card? Reroute calls? Identity? Anything else? First born? Uninstalled."
app repackaging,app repackaging
app ranking fraud,"Stop talking nonsense. Comments and stars are brushed. This thing is not as good as you think	"
bad performance,"The software is OK, but it's a little retarded!"
fail to delete,"The software is OK, but it's a little retarded! Can't delete unwanted app? You can't delete it! And I've seen it, and I'll never read it! It's silly to kill people!!!	"
fail to login or register,Garbage as I cannot log in to it to use it...waste of time!!
ad disruption,Its boring. And too many ads
fail to retrieve content,"The updated TPO listening answer sheet will be blank	"
bad performance,"At first, it looked good when it came to the mobile phone. It looked like that, but the picture was monotonous, the plot was common, and the operation was difficult to control. Let's just forget it, let's bear it, but after a few passes, the card owner didn't move. I think it's OK to shut it down by force, but it's impossible to do anything. It's forced to remove the battery, so I can only give a bad comment	"
permission abuse,"I don't know what you want my location permission and phone permission to do? Why does xodocs only need storage permission?	"
payment deception,"1) i installed and I searched for a number location and it gave me approx reading, ok fine! 2)next I proceed to get a monthly subscription paying Rs 249.00 3) after payment was successful then I tried again selecting With new number but its again asking me to upgrade @support-team please make sure you give me good support or refund my money, i.e INR 249"
vulgar content,I like tiktok very much but I want to come sexual content in tiktok
fail to install,"Why did the installation fail	"
fail to delete,"Why can't you delete this software when the training time is negative or tens of millions of minutes? Is it funny?	"
illegal redirection,"After the update, the title is the next episode. If the content is still playing the original episode, you have to quit playing and click the next episode. The more updated, the more unbearable it is	"
vulgar content,"Met alot of racist people, but even more nice people."
fail to delete,"Don't go down! You can't delete it after it's been downloaded	"
inconsistency between functionality and description,"Inconsistent application performance issues really full the experience and make it difficult to interaction with users (after all it IS the sole purpose of the app). For example, comments on an initial like are not being saved. Update - do not pay for preferred. Any update seems to disable any and paid subscriptions. Support useless in resolving."
drive-by download,i love this app it is so fun let me warn you once you download this app u will become addicted
fail to retrieve content,This app no longer works. All I ever get is a blank page.
bad performance,"There's no way to check the displacement. There's no option, or the crash feedback can't be solved. It's really unspeakable	"
payment deception,Me have to pay too and I hate IIIIIIITTTT  Rainbow sheep rock!
payment deception,We still have to pay
payment deception,I have to pay and im just a kid
vulgar content,Very nice app but do much sexual and illegal society are more plzz action on this
fail to delete,"It is complicated to update the bill. You can only add credit cards and cannot delete it. Use with caution	"
vulgar content,I honestly love the app? but some minor problems are: the boys and so much more. They always bodyshame and sexualize EVERYBODY on the app
payment deception,"6 dollar an hour, 4 dollar for members is better than going to an Internet cafe? Did the black screen drop and Caton solve it? It's called a second a card "
bad performance,"6 yuan an hour, 4 yuan for members is better than going to an Internet cafe? Did the black screen drop and Caton solve it? It's called a second a card	"
fail to login or register,"The registration status indicates that it is being reviewed or registered	"
drive-by download,It's like the best! I've been using this for like a few month then deleted tik tok so now I cant download it again :(
excessive network traffic,Upload data tens of M and download tens of M. who can tell me why?!?! 
bad performance,"I really don't understand why I don't open the software and stop sending and receiving data in the background. Why do I put my mobile phone on the desk for a few hours at night? It almost consumes half of my note3 power. Look at the power consumption. This application ranks first. Upload data tens of M and download tens of M. who can tell me why?!?!	"
fail to start,"Garbage can't be opened. Don't download it. It's too garbage!	"
fail to start,"Shit! Perfect loading and unloading of Samsung 7100 black screen	"
app repackaging,"How about piracy	"
fail to install,"i will give five stars to this app,but the problem is unfortunately this app was uninstalled from mobile and now more than 50 times i tried to download this app but remained fail. kindly fix this issue. after completion of download it is not being installed in my phone. thanks in advance"
ad disruption,"I tried to figure-out how to ad my Rental property, but there was absolutely no directions, or chance to do so"
ad disruption,Only advertising is too bad 
fail to retrieve content,"Why is it blank? Only advertising is too bad	"
vulgar content,Its good.I just wish I could create my own creepy pastast or yon the app.
fail to login or register,I love it but how do u get back in if u dont know what ur login is for a long time ?
app ranking fraud,"Please pay for the amount of downloads and comments. Thank you	"
bad performance,Dose not work on Acer iconia one 7. Will not take pictures.
bad performance,"Every time I work on a template and go to save, it crashes. Both save files jpeg and png"
permission abuse,"You can't even log in. You need root permission. Why do you have this broken software	"
permission abuse,"Enforce address book permissions. What do you want	"
fail to install,"Repeatedly update and download, but I can't install it. I don't want to play anymore	"
fail to install,"Cannot install after downloading!	"
vulgar content,tiktok is good and bad because people can be perverts and creeps and it's good because well it's good
privacy or information leak,"It's good to be able to record this data I just painted the new firmware. The contents are gone Cup set But it's really easy to use	"
excessive network traffic,"Big traffic, lie to me	"
app repackaging,"How to download the cracked version	"
fail to start,"As soon as the garbage goes in, the screen goes black	"
fail to login or register,"Too ordinary software, always unable to log in to online banking	"
drive-by download,Help me download this app is really fun so let me download this app please
vulgar content,I love this app but I do not recomened it to people under 10 because there is swearing in it and it talks about sex
app repackaging,"To crack the version of quick QQ email	"
app repackaging,"If you can crack the next version, you don't have to pay	"
fail to start,Not working in my motog5s plus
fail to login or register,"App  would not allow me to use or create an account on my phone ive tried it several days and it continues to tell me, ""Please try again later."""
fail to start,Keeps crashing
payment deception,They give bare minimum to claim its free everything is a push to make you pay. I
inconsistency between functionality and description,"Horrible app. They give bare minimum to claim its free everything is a push to make you pay. It's full of outdated inactive accounts and fake accounts. Used to be good but now it is very scammy.. If I could give 0 stars I would. EDIT after bumble's response to my review above: bumble's focus on my review is is only on suspicious accounts and reporting them. they ignore the rest of my review. no addressing bumble's scam nature, the outdated accounts, bumble's behavior and how the app has degraded into a dumpster fire over time. Just another dishonest company. 0 stars given. Bumble is Horrible. just in the couple days since my review the average review for bumble has dropped well over 1 star. whoever is in charge is driving the flaming garbage truck known as bumble off a ravine. really is a shame once it was a good app. now i'ts no different than match, meetme, or any of the other scam type dating apps. i had even paid for service last year and even after canceling per instructions they still renewed/charged me and took a while to get my money back. these days their daily likes you can give seem random one day you will get 10 likes for the whole day.. over 24 hrs later you've still ""reached your limit for the day"" the number of likes you can give seems very inconsistent and manipulative to get you to pay for a service that isn't worth it. my advice ... abandon ship.. stay away... never give em a penny.. learn from other's mistakes, from my experience they're dishonest. it's a scam. do research online on them before installing. just a little research will show the opinion they are a scam is common."
